{"schema_version":1,"baseline_id":"plugin-provider-parity-v1","providers":[{"id":"source.qqnt","category":"source","distribution":"ohmymeme-plugin-qqnt","entry_point":"ohmymeme.plugins.v1:source.qqnt = ohmymeme_plugin_qqnt:create_plugin","current_identifier":"ohmymeme.integrations.imports.qqnt","flow":["inspect_environment","select_account","copy_images","normalize_extensions"],"state":["idle","checking","copying","done","error","cancelled"],"paths":["UserDataInfo.ini","<UserDataSavePath>/<QQ号>/nt_qq/nt_data/Emoji/personal_emoji/Ori","%APPDATA%/OhMyMeme/cache"],"protocols":["filesystem","magic-bytes"],"abi":{"aliases":["qqnt_check_env","qqnt_start","qqnt_get_progress","qqnt_cancel"],"actions":["check_env","start","get_progress","cancel"]},"package_root":"ohmymeme_plugin_qqnt","license_provenance":"GPL-3.0:QQFavoriteExtract adaptation","allowed_variance":["ids","timestamps","temporary paths","thread ordering"]},{"id":"source.telegram","category":"source","distribution":"ohmymeme-plugin-telegram","entry_point":"ohmymeme.plugins.v1:source.telegram = ohmymeme_plugin_telegram:create_plugin","current_identifier":"ohmymeme.integrations.imports.telegram","flow":["locate_tdata","derive_key","decrypt_cache","convert_webm","deduplicate","import"],"state":["idle","scanning","loading_key","decrypting","converting","deduping","importing","done","error","cancelled"],"paths":["%APPDATA%/Telegram Desktop/tdata","<tdata>/user_data/cache","<tdata>/user_data/media_cache","system temporary directory"],"protocols":["TDF$ AES-IGE","TDEF AES-CTR","ffmpeg"],"abi":{"aliases":["pick_tg_tdata","start_tg_import","get_tg_import_progress","cancel_tg_import"],"actions":["pick_tdata","start","get_progress","cancel"]},"package_root":"ohmymeme_plugin_telegram","license_provenance":"GPL-3.0 project license","allowed_variance":["ids","timestamps","temporary paths","thread ordering"]},{"id":"source.douyin","category":"source","distribution":"ohmymeme-plugin-douyin","entry_point":"ohmymeme.plugins.v1:source.douyin = ohmymeme_plugin_douyin:create_plugin","current_identifier":"ohmymeme.integrations.imports.douyin","flow":["build_session","check_login","list_stickers","sign_requests","download","import"],"state":["idle","running","done","error","cancelled"],"paths":["system temporary directory","%APPDATA%/OhMyMeme"],"protocols":["HTTPS","ABogus","Chrome124 TLS fingerprint"],"abi":{"aliases":["start_douyin_import","get_douyin_import_progress","cancel_douyin_import"],"actions":["start","get_progress","cancel"]},"package_root":"ohmymeme_plugin_douyin","license_provenance":"GPL-3.0:ABogus source provenance; project GPL-3.0","allowed_variance":["ids","timestamps","temporary paths","thread ordering"]},{"id":"source.wechat","category":"source","distribution":"ohmymeme-plugin-wechat","entry_point":"ohmymeme.plugins.v1:source.wechat = ohmymeme_plugin_wechat:create_plugin","current_identifier":"ohmymeme.integrations.imports.wechat","flow":["inspect_environment","select_account","verify_helper","extract_key","decrypt_sqlite_wal","download_cdn","import"],"state":["idle","scanning","querying","extracting_key","decrypting_db","downloading","importing","done","error","cancelled"],"paths":["<root>/wxid_*/db_storage/emoticon/emoticon.db","<root>/wxid_*/db_storage/favorite/favorite.db","%LOCALAPPDATA%/OhMyMeme/.wechat"],"protocols":["supervised helper subprocess","AES-256-CBC","SQLite/WAL","allowlisted HTTPS CDN"],"abi":{"aliases":["inspect_wechat_environment","start_wechat_import","get_wechat_import_progress","cancel_wechat_import"],"actions":["inspect_environment","start","get_progress","cancel"]},"package_root":"ohmymeme_plugin_wechat","license_provenance":"GPL-3.0 project license; helper source provenance","allowed_variance":["ids","timestamps","temporary paths","thread ordering"]},{"id":"sync.ftp","category":"sync","distribution":"ohmymeme-plugin-sync-ftp","entry_point":"ohmymeme.plugins.v1:sync.ftp = ohmymeme_plugin_sync_ftp:create_plugin","current_identifier":"ohmymeme.services.sync.backends._FtpBackend","flow":["connect","ensure_remote_dir","push_or_pull","finalize_manifest"],"state":["idle","connecting","uploading","downloading","deleting","done","error","cancelled"],"paths":["{root}/memes/","{root}/meme-index.json","ftp_path"],"protocols":["FTP","FTPS","UTF-8","PROT P"],"abi":{"aliases":["sync_push","sync_pull","sync_test","get_sync_progress"],"actions":["push","pull","test","get_progress"]},"package_root":"ohmymeme_plugin_sync_ftp","license_provenance":"GPL-3.0 project license","allowed_variance":["ids","timestamps","temporary paths","thread ordering"]},{"id":"sync.s3","category":"sync","distribution":"ohmymeme-plugin-sync-s3","entry_point":"ohmymeme.plugins.v1:sync.s3 = ohmymeme_plugin_sync_s3:create_plugin","current_identifier":"ohmymeme.services.sync.backends._S3Backend","flow":["create_client","upload_or_download","merge_manifest","finalize"],"state":["idle","connecting","uploading","downloading","deleting","done","error","cancelled"],"paths":["{root}/memes/","{root}/meme-index.json","s3_path"],"protocols":["S3 API","signature v2/v4 compatibility","virtual/path addressing"],"abi":{"aliases":["sync_push","sync_pull","sync_test","get_sync_progress"],"actions":["push","pull","test","get_progress"]},"package_root":"ohmymeme_plugin_sync_s3","license_provenance":"GPL-3.0 project license","allowed_variance":["ids","timestamps","temporary paths","thread ordering"]},{"id":"sync.r2","category":"sync","distribution":"ohmymeme-plugin-sync-r2","entry_point":"ohmymeme.plugins.v1:sync.r2 = ohmymeme_plugin_sync_r2:create_plugin","current_identifier":"ohmymeme.services.sync.backends._R2Backend","flow":["derive_endpoint","create_client","upload_or_download","merge_manifest","finalize"],"state":["idle","connecting","uploading","downloading","deleting","done","error","cancelled"],"paths":["{root}/memes/","{root}/meme-index.json","r2_path"],"protocols":["Cloudflare R2 S3 API","signature v4","virtual/path addressing"],"abi":{"aliases":["sync_push","sync_pull","sync_test","get_sync_progress"],"actions":["push","pull","test","get_progress"]},"package_root":"ohmymeme_plugin_sync_r2","license_provenance":"GPL-3.0 project license","allowed_variance":["ids","timestamps","temporary paths","thread ordering"]},{"id":"sync.webdav","category":"sync","distribution":"ohmymeme-plugin-sync-webdav","entry_point":"ohmymeme.plugins.v1:sync.webdav = ohmymeme_plugin_sync_webdav:create_plugin","current_identifier":"ohmymeme.services.sync.backends._WebDAVBackend","flow":["connect","ensure_remote_dir","upload_or_download","merge_manifest","finalize"],"state":["idle","connecting","uploading","downloading","deleting","done","error","cancelled"],"paths":["{root}/memes/","{root}/meme-index.json","webdav_path"],"protocols":["WebDAV","PROPFIND","PUT","GET","DELETE","Basic Auth"],"abi":{"aliases":["sync_push","sync_pull","sync_test","get_sync_progress"],"actions":["push","pull","test","get_progress"]},"package_root":"ohmymeme_plugin_sync_webdav","license_provenance":"GPL-3.0 project license","allowed_variance":["ids","timestamps","temporary paths","thread ordering"]},{"id":"transport.lan","category":"transport","distribution":"ohmymeme-plugin-lan","entry_point":"ohmymeme.plugins.v1:transport.lan = ohmymeme_plugin_lan:create_plugin","current_identifier":"ohmymeme.services.lan.protocol","flow":["udp_discovery","tcp_handshake","device_approval","encrypted_commands","close"],"state":["stopped","starting","listening","handshaking","awaiting_confirmation","connected","stopping","done","error"],"paths":["0.0.0.0:<port>","%APPDATA%/OhMyMeme/config.json","%LOCALAPPDATA%/OhMyMeme/cache"],"protocols":["UDP discovery","TCP length-prefixed JSON","HMAC-SHA256","PBKDF2-SHA256","AES-GCM"],"abi":{"aliases":["lan_start","lan_stop","lan_get_status","lan_confirm_device","lan_set_allow_secret_config"],"actions":["start","stop","get_status","confirm_device","set_allow_secret_config"]},"package_root":"ohmymeme_plugin_lan","license_provenance":"GPL-3.0 project license","allowed_variance":["ids","timestamps","temporary paths","thread ordering"]}],"excluded_plugins":["adb.qq","qq.mobile"],"source_references":["src/ohmymeme/integrations/imports","src/ohmymeme/services/sync","src/ohmymeme/services/lan","src/ohmymeme/core/schemas/bridge.py","README.md","LICENSE","setup.py"],"allowed_variance":["ids","timestamps","temporary paths","thread ordering"],"ui_baseline":"fixtures/plugin-parity/ui-baseline.json"}
